{
  "schema_version": 1,
  "tenant_id": "dev",
  "provider": "alpaca",
  "change_type": "ROTATE",
  "outcome": "SAVED",
  "actor": "api-gateway:/broker-credentials",
  "occurred_at": "2026-06-15T13:35:00Z",
  "broker_account_id": "PA3FKGPFYPLH",
  "credential_version": 2,
  "kek_version": 1,
  "correlation_id": "req-7f3b1d40"
}
